{
  "$id": "Entity-schema.json",
  "$schema": "https://json-schema.org/draft-07/schema",
  "version": "0.9",
  "description": "Designates something that exists, a being, a tangible or abstract object with properties and relationships.\nThing of interest in the considered environment / mini-world.\nIt is an IT-system- and technology-independent and consolidated description of the structure and meaning of the thing of interest.\nAn entity  consist of individual parts (attributes, subentities, etc.).\nAn entity name is unique in the considered environment and the definition of the entity (attributes, description, rules, relationships,...) is the only valid definition expressed with this name.",
  "type": "object",
  "properties": {
    "$id": {
      "description": "full identification path of the element",
      "$ref": "GeneralTypes-schema.json#/components/$defs/Uri"
    },
    "elementid": {
      "description": "unique ID of the entity for reference purposes within the model or mme-environment\nOnly used (and stable) in current version of model. Can change over time, as it is only used",
      "$ref": "#/components/$defs/EntityId"
    },
    "name": {
      "description": "uniuque 'official' name for the thing of consideration",
      "$ref": "GeneralTypes-schema.json#/components/$defs/SomeName"
    },
    "shortname": {
      "description": "unique short name of the entity to be used for short references in text.\n must be unique in the environment",
      "$ref": "GeneralTypes-schema.json#/components/$defs/ShortName"
    },
    "description": {
      "description": "Meaning, Benefits, Use of the Entity",
      "$ref": "GeneralTypes-schema.json#/components/$defs/SomeText"
    },
    "shortdescr": {
      "description": "Short text explaining the meaning for the user în the user interface (hint, tooltip).",
      "$ref": "GeneralTypes-schema.json#/components/$defs/SomeText"
    },
    "categoryid": {
      "description": "Category the entity belongs to",
      "$ref": "Category-schema.json#/components/$defs/CategoryId"
    },
    "synonyms": {
      "description": "List of synonym names for this thing beeing used in old systems or out of habit. Not unique.",
      "type": "array",
      "items": {
        "$ref": "GeneralTypes-schema.json#/components/$defs/SomeName"
      },
      "uniqueItems": true
    },
    "examples": {
      "descriptions": "some example values which are typical for this entity",
      "$ref": "GeneralStructures-schema.json#/components/schemas/Examples"
    },
    "keys": {
      "description": "List of keys containing information to identify on instance of this entity.\nA key consist of one or several attributes and relationships, whose values in combination are unequivocal, no matter how many instances there are. There may be any number of keys for one entity.",
      "type": "array",
      "items": {
        "$ref": "#/components/schemas/Key"
      },
      "uniqueItems": true
    },
    "additionalProps": {
      "description": "additional properties (aka user defined properties udp) are  any properties of an this element  added by the current modeller. They serve as an extension to the predfefined element properties.",
      "$ref": "GeneralStructures-schema.json#/components/schemas/AdditionalProperties"
    }
  },
  "required": [
    "name",
    "elementid"
  ],
  "additionalProperties": false,
  "examples": [],
  "components": {
    "schemas": {
      "Key": {
        "description": "combination of attributes and (functional or 1:1) relationships whose combined values are unique over all instances of an entity",
        "type": "array",
        "items": {
          "anyOf": [
            {
              "$ref": "Attribute-schema.json#/components/$defs/AttributeId"
            },
            {
              "$ref": "Relation-schema.json#/components/$defs/RelationId"
            }
          ]
        },
        "uniqueItems": true,
        "examples": [
          [
            "name",
            "birthdate"
          ],
          [
            "is in country",
            "zip-code"
          ]
        ]
      }
    },
    "$defs": {
      "EntityId": {
        "description": "typed ID unique over all eneities in this model",
        "allOf": [
          {
            "$ref": "GeneralTypes-schema.json#/components/$defs/ElementId"
          },
          {
            "pattern": ".*ENTI[0-9]+$"
          }
        ]
      }
    }
  }
}
